Nama Produk,harga,pengiriman,diskon
S-tee Minuman Teh Kotak,2500,Instant,0.0
Yeo's Minuman Rasa Bunga Krisantemum,7700,Instant,0.0
Fanta Grape Minuman Soda Botol,5900,Instant,0.0
Coca-Cola Zero Minuman Soda Can,6400,Instant,0.0
A&W Sarsaparila Minuman Soda Can,7200,Instant,0.0
Pocari Sweat Minuman Isotonik Botol,8900,Instant,0.0
Fanta Strawberry Minuman Soda Botol,5900,Instant,0.0
Mizone Activ Lychee Lemon Minuman Isotonik,6400,Instant,0.0
Tebs Sparkling Mix Fruit Carbonated Tea Drink PET,8800,Instant,0.0
Coca-Cola Zero Minuman Soda Botol,11500,Instant,0.0
Mizone Coco Boost Minuman Isotonik,6500,Instant,0.0
Sprite Minuman Soda Can Dus 250ml,148000,Instant,0.0
Fanta Strawberry Minuman Soda Can,6400,Instant,0.0
Coca-Cola Minuman Soda Botol,11500,Instant,0.0
Sprite Zero Sugar Minuman Soda Botol,11500,Instant,0.0
Coca-Cola Zero Minuman Soda Can Dus 250ml,119400,Instant,0.0
Coca-Cola Minuman Soda Can Dus 250ml,119400,Instant,0.0
Bundaberg Ginger Beer Minuman Soda Non Alcohol,30400,Instant,0.0
Sprite Zero Sugar Minuman Soda Botol,5900,Instant,0.0
Cap Badak Rootbeer Minuman Soda,25000,Instant,0.0
Sprite Minuman Soda Botol,11500,Instant,0.0
Sprite Minuman Soda Botol,5900,Instant,0.0
Sprite Waterlymon Minuman Soda Botol,5300,Instant,0.0
Fanta Orange Minuman Soda Botol,5900,Instant,0.0
Groovy Root Brew Minuman Soda Can,8000,Instant,0.0
Coca-Cola Classic Minuman Soda Can,6400,Instant,0.0
Coca-Cola Zero Minuman Soda PET,5900,Instant,0.0
Coca-Cola Minuman Soda Botol,5500,Instant,0.0
Fanta Strawberry Minuman Soda Botol,11500,Instant,0.0
Nutrive Benecol Orange Minuman Sehat,9500,Instant,0.0
Hydro Coco Minuman Air Kelapa Original,8800,Instant,0.0
Minuman Botanikal Astro Goods,30875,Instant,5.0
Adem Sari Minuman Penyejuk 7gr x 5pcs,17777,Instant,3.0
Fibe-Mini Fiber Drink Multipack 100ml,50500,Instant,0.0
Fibe Mini Fiber Drink,8500,Instant,0.0
Oronamin C Drink,7300,Instant,0.0
Larutan Cap Kaki Tiga Anak Rasa Stroberi Can,6100,Instant,7.0
Acaii Tea Pink Drink,24400,Instant,0.0
Yeo's Minuman Sari Kedelai,7800,Instant,0.0
Sosro Tehbotol Less Sugar,4600,Instant,0.0
Teh Pucuk Harum Melati,3700,Instant,0.0
Pokka Green Tea Jasmine,6400,Instant,0.0
Ichitan Green Tea Honey Lemon,4900,Instant,0.0
Pokka Oolong Tea Less Sugar,6400,Instant,0.0
Ito En Oi Ocha Hojicha,11900,Instant,0.0
Ito En Jasmine Green Tea Unsweetened,12100,Instant,0.0
Ultrajaya Teh Kotak Rasa Apel,4200,Instant,0.0
Teh Botol Sosro Dus 250ml,86400,Instant,0.0
Sosro Fruit Tea Blackcurrant,6900,Instant,0.0
Ultrajaya Teh Kotak Jasmine Less Sugar,4200,Instant,0.0
Ito En Oi Ocha Unsweetened Green Tea,11100,Instant,0.0
Ito En Unsweetened Oolong Tea,11100,Instant,0.0
Pokka Green Tea No Sugar,10300,Instant,0.0
Ito En Oi Ocha Unsweetened Green Tea,22700,Instant,0.0
Ichitan Thai Milk Green Tea,9300,Instant,0.0
Nu Green Tea Original,5100,Instant,0.0
Ito En Unsweetened Barley Tea,13500,Instant,0.0
Pokka Teh Leci,6700,Instant,0.0
Nu Milk Tea,8300,Instant,0.0
Pokka Lemon Tea,6700,Instant,0.0
Ultrajaya Teh Kotak Jasmine,4200,Instant,0.0
Sosro Joy Tea Oolong Unsweetened PET 350ml,7000,Instant,0.0
Ichitan Green Tea Apple,4900,Instant,0.0
Ultrajaya Teh Kotak Jasmine,13500,Instant,0.0
Ultrajaya Teh Kotak Jasmine Less Sugar,10900,Instant,0.0
Pokka Oolong Tea No Sugar,11300,Instant,0.0
Ultrajaya Teh Kotak Rasa Leci,4200,Instant,0.0
Ultrajaya Teh Kotak Rasa Mangga,4200,Instant,0.0
Ultrajaya Teh Kotak Jasmine Less Sugar 300ml,103200,Instant,0.0
Ultrajaya Teh Kotak Jasmine 300ml,103200,Instant,0.0
Ichitan Thai Milk Tea,9300,Instant,0.0
Ichitan Thai Milk Coffee,9500,Instant,0.0
Ichitan Brown Sugar Milk,9300,Instant,0.0
Teh Pucuk Harum,3300,Instant,0.0
Ultrajaya Teh Kotak Rasa Lemon,4200,Instant,0.0
Ultrajaya Teh Kotak Rasa Blackcurrant,4200,Instant,0.0
Teh Botol Sosro Original,3600,Instant,0.0
Sosro Tehbotol,3900,Instant,0.0
Teh Bandulan Dus 160ml,31500,Instant,0.0
Nu Green Tea Original,7300,Instant,0.0
Nu Green Tea Madu,7300,Instant,0.0
Sosro Tehbotol,11200,Instant,0.0
Yeo's Winter Melon Tea,7700,Instant,0.0
Sosro Tehbotol Original Botol,4600,Instant,0.0
Pokka Green Tea Jasmine Can,9800,Instant,0.0
Teh Pucuk Harum Melati,6200,Instant,0.0
Frestea Jasmine Lychee Honey Tea,17100,Instant,0.0
Nipis Madu Lime Soda,4200,Instant,0.0
Beli 3 Coca-Cola Zero Free Changing Color Cup,17700,Instant,0.0
Combo Coca-Cola x Belfoods,26800,Instant,16.0
Combo Hemat Pocari dan Oronamin C,16200,Instant,0.0
Polaris Ginger Ale Can,6900,Instant,8.0
Polaris Bitter Lemon Can,6900,Instant,8.0
Polaris Sarsaparila Can,7000,Instant,8.0
Polaris Coffee Cream Can,6900,Instant,8.0
Nipis Madu Dus 330ml,59400,Instant,0.0
Green Sands Apple Lime Can,6600,Instant,0.0
Fanta Strawberry Can Dus 250ml,119400,Instant,0.0
Sprite Zero Can Dus 250ml,119400,Instant,0.0
A&W Sarsaparila Can Dus 250ml,126000,Instant,0.0
Schweppes Soda Water Can Dus 250ml,124000,Instant,0.0
Schweppes Ginger Ale Can Dus 250ml,124000,Instant,0.0
Fanta Strawberry Zero PET,5900,Instant,0.0
Schweppes Soda Water Can,8000,Instant,0.0
Schweppes Ginger Ale CAN,6300,Instant,0.0
Schweppes Botanical Tonic Water Can Dus 250ml,138000,Instant,0.0
Polaris Soda Water Can,6000,Instant,8.0
Ion Water Pet,7400,Instant,0.0
Groovy Zoda Soda Water,5700,Instant,0.0
Green Sands Lemon & Grape Can,6300,Instant,0.0
Sprite Botol,5500,Instant,0.0
Mizone Mood Up Isotonic Cranberry & White Tea Botol,6400,Instant,0.0
Schweppes Botanical Tonic Water Can,6300,Instant,0.0
Green Sands Original Lime & Apple Can,9100,Instant,0.0
Hemaviton C1000 Lemon Can,5700,Instant,10.0
Sereh Jahe Madu Astro Goods,30875,Instant,5.0
Adem Sari Chingku Lemon Botol,9414,Instant,3.0
Nutrive Benecol Blackcurrant Multipack 100ml,54100,Instant,5.0
Oronamin C Multipack 120ml,42000,Instant,0.0
Larutan Cap Kaki Tiga,9300,Instant,0.0
YOU-C 1000 Orange,8200,Instant,0.0
Namaste Organic Alchemy Jamu,172800,Instant,0.0
Tropicana Slim Collagen Shot Peach Blossom 190ml,9900,Instant,10.0
Nutrifarm Sari Buah Lemon,29000,Instant,0.0
Acaii Tea Vege Shot,24000,Instant,0.0
Acaii Tea Skinlift Tea,45000,Instant,0.0
Acaii Tea Kids Jelly Lemon,17000,Instant,0.0
Acaii Tea Kids Anti Flu Shot,25000,Instant,0.0
Acaii Tea Black Lemon,25000,Instant,0.0
Acaii Tea Skinny Lemonade,25000,Instant,0.0
Acaii Tea Glow Recipe,25000,Instant,0.0
Malee Coconut Water Botol,24000,Instant,6.0
Malee Coconut Water,57300,Instant,5.0
Cap Panda Sarang Burung Kaleng Dus Nataru 310ml,124000,Instant,14.0
Beli Fibe Mini Multipack Gratis Bucket Bag,101000,Instant,0.0
Nutrive Benecol Orange Multipack 100ml,54100,Instant,5.0
Cap Panda Bird Nest,6700,Instant,6.0
Lasegar Twist Leci Lemon,6900,Instant,0.0
Mamita Mambucha Teh Fermentasi Original Kombucha Bottle,57000,Instant,0.0
Mamita Mambucha Artisan Tea Lavender Bottle,57000,Instant,0.0
Tarami Konjac Grape Jelly Pouch,28900,Instant,0.0
Acaii Tea x Chris CSB Red Power Shot,23630,Instant,15.0
Acaii Tea Kids Pink Dragon,16500,Instant,0.0
Acaii Tea Strawberry Chia Jelly,23100,Instant,0.0
Acaii Tea Detox Shot,29000,Instant,0.0
Acaii Tea Kids Jelly Berry,16500,Instant,0.0
Kayu Manis Jahe Astro Goods,29300,Instant,10.0
Kunyit Asam Astro Goods,30875,Instant,5.0
Coco Loco Kelapa Ijo,34900,Instant,0.0
Vegeta Herbal Anggur Merah 5gr,20200,Instant,0.0
Nutrive Benecol Strawberry,9500,Instant,0.0
Nutrive Benecol Lychee,9500,Instant,0.0
Nutrive Benecol Blackcurrant,9500,Instant,0.0
Scrubber Vegeta Jeruk,14900,Instant,0.0
Cap Panda Grass Jelly Basil Seed,6700,Instant,6.0
Kiranti Juice Orange,9500,Instant,0.0
Ichitan Thai Coco Water,7600,Instant,0.0
Larutan Cap Kaki Tiga Cooltopia Lemon Lime,6600,Instant,6.0
Larutan Cap Kaki Tiga Jambu Can,6600,Instant,6.0
Larutan Cap Kaki Tiga Grape,6600,Instant,6.0
Larutan Cap Kaki Tiga Anak Rasa Leci,6100,Instant,7.0
Acaii Tea Anti-Batuk Shot,25100,Instant,0.0
[CHILLED] YOU-C 1000 Orange,9200,Instant,0.0
YOU-C 1000 Mango,8200,Instant,0.0
Cap Panda Liang Teh,6700,Instant,6.0
Cap Panda Grass Jelly,6700,Instant,6.0
Acaii Tea Super Orange,27800,Instant,0.0
Acaii Tea Bee & C Shot,24400,Instant,0.0
Acaii Chlorophyll Green,18100,Instant,0.0
Acaii Tea Teatox Berry,23100,Instant,0.0
Acaii Tea Honey Lemon Jelly,23100,Instant,0.0
Acaii Tea Anti-flu Shot,25100,Instant,0.0
Coco Loco Coconut Water,34900,Instant,0.0
Hemaviton Vitamin C 1000 Orange,7000,Instant,8.0
Ultra Sari Kacang Ijo,5600,Instant,0.0
Larutan Cap Kaki Tiga Orange,6600,Instant,6.0
Kiranti Sehat Datang Bulan Original,8100,Instant,0.0
Adem Sari Ching Ku Sparkling Herbal Lemon,9252,Instant,4.0
YOU-C 1000 Apple,8200,Instant,0.0
YOU-C 1000 Lemon Water,9300,Instant,0.0
Larutan Penyegar Cap Kaki Tiga,4000,Instant,7.0
YOU-C 1000 Lemon,8200,Instant,0.0
YOU-C 1000 Orange Water,9300,Instant,0.0
Larutan Cap Kaki Tiga Anak Tawar,4000,Instant,7.0
Larutan Cap Kaki Tiga Leci,6600,Instant,6.0
Rejuve Cold Pressed Juice Green Glory,57000,Instant,0.0
Rejuve Cold Pressed Juice Beat That,47000,Instant,0.0
Rejuve Cold Pressed Juice Asian Green,47000,Instant,0.0
Rejuve Cold Pressed Juice U.Glow,47000,Instant,0.0
Rejuve Cold Pressed Juice I.Glow,47000,Instant,0.0
Evian Natural Mineral Water Glass 330ml x 20pcs,720000,Instant,0.0
Evian Natural Mineral Water PET 500ml x 24pcs,572000,Instant,0.0
Evian Natural Mineral Water PET 1500ml x 12pcs,516500,Instant,0.0
Evian Natural Mineral Water PET 750ml x 12pcs,479500,Instant,0.0
AQUA Air Mineral Dus 330ml,61700,Instant,7.0
Evian Natural Mineral Water PET 330ml x 24pcs,297850,Instant,30.0
Evian Sparkling Mineral Water Glass 330ml x 20pcs,685000,Instant,0.0
Aquviva Air Mineral Botol 700ml,27800,Instant,0.0
Nestle Pure Life Air Mineral Multipack 1500ml,29600,Instant,0.0
Beli 2 Carton Aquviva 1600ml Free Totebag Aquviva,70200,Instant,0.0
[Bundle] 6x Pristine Air Mineral 600ml,30000,Instant,0.0
[Bundle] 6x Pristine Air Mineral 1500ml,55800,Instant,0.0
[Bundle] 6x Pristine Air Mineral 400ml,18600,Instant,0.0
Prima Air Mineral Dus 24pcs x 600ml,44700,Instant,0.0
Prima Air Mineral Dus 24pcs x 330ml,39600,Instant,0.0
Evian Natural Mineral Water Glass,38500,Instant,0.0
Evian Sparkling Mineral Water Glass,40500,Instant,0.0
Evian Natural Mineral Water PET,54800,Instant,0.0
Evian Natural Mineral Water PET,41500,Instant,0.0
Ron88 Air Mineral Botol Dus 1500ml,47000,Instant,0.0
Ron88 Air Mineral Botol Dus 600ml,45000,Instant,0.0
Ron88 Air Mineral Botol Multipack 380ml,38500,Instant,0.0
Ron88 Air Mineral Botol Multipack 240ml,25000,Instant,0.0
Hydra Thera Natural Mineral Water,30000,Instant,0.0
Cleo Air Murni,5900,Instant,0.0
Bundling Mineral Water Astro Goods Multipack 600ml,18000,Instant,0.0
AQUA Air Mineral Botol Dus 1500ml,86400,Instant,0.0
Le Minerale Air Mineral Dus 330ml,57600,Instant,0.0
AQUA Air Mineral Botol Dus 600ml,73600,Instant,0.0
Aquviva Air Mineral 250ml,29000,Instant,0.0
Bundle Aquviva 700ml,15600,Instant,4.0
 Aquviva Air Mineral 1600ml,35100,Instant,0.0
Bundling Mineral Water Astro Goods Multipack 1500ml,25200,Instant,0.0
Aquviva Mineral Water Botol,2700,Instant,0.0
Aquviva Air Mineral,5900,Instant,0.0
Evian Natural Mineral Water PET,18700,Instant,0.0
ViCA Air Mineral Dus 220ml,29800,Instant,0.0
Cleo Air Murni Botol Multipack 1500ml,36900,Instant,0.0
Nestle Pure Life Air Mineral Botol Dus 1500ml,54000,Instant,0.0
Vit Air Mineral Dus 1500ml,56600,Instant,0.0
Evian Natural Mineral Water PET,23300,Instant,0.0
Vit Air Mineral Cup Dus 200ml,30400,Instant,0.0
AQUA Reflections Still Water Glass Bottle,20100,Instant,0.0
Mineral Water Astro Goods Dus 1500ml,52020,Instant,15.0
Cleo Air Murni Multipack 220ml,28800,Instant,0.0
Mineral Water Astro Goods Dus 600ml,61200,Instant,15.0
Mineral Water Astro Goods Botol,3000,Instant,0.0
Mineral Water Astro Goods Botol,4200,Instant,0.0
Prima Air Mineral Botol,1300,Instant,38.0
Cleo Air Murni Botol,6400,Instant,0.0
AQUA Click n Go Air Mineral Botol,7200,Instant,0.0
Vit Air Mineral,4700,Instant,0.0
AQUA Reflections Sparkling Water Glass Bottle,21000,Instant,0.0
AQUA Air Mineral Multipack 600ml,20600,Instant,0.0
AQUA Cube Air Mineral Dus 220ml,33600,Instant,0.0
Nestle Pure Life Air Mineral Multipack 600ml,15500,Instant,0.0
Nestle Pure Life Air Mineral Botol,6000,Instant,0.0
Nestle Pure Life Air Mineral Botol,2800,Instant,0.0
Amidis Distilled Air Mineral Botol,4700,Instant,0.0
AQUA Air Mineral Multipack 1500ml,38400,Instant,0.0
Le Minerale Air Mineral Botol,6100,Instant,0.0
Pristine Air Mineral Botol,9300,Instant,0.0
Pristine Air Mineral Botol,5000,Instant,0.0
Pristine Air Mineral Botol,3100,Instant,0.0
Crystaline Air Mineral Botol,2700,Instant,0.0
AQUA Air Mineral Cup Dus 200ml,49600,Instant,0.0
Eternal Plus Alkaline Water Botol,10500,Instant,0.0
Le Minerale Air Mineral Botol,2900,Instant,0.0
AQUA Air Mineral Botol,7200,Instant,0.0
AQUA Air Mineral Botol,3500,Instant,0.0
Minute Maid Pulpy Orange,6400,Instant,0.0
Minute Maid Pulpy Orange,15400,Instant,0.0
Tani Organic Pure Lemon Juice Alora,32500,Instant,0.0
Combo Minute Maid x Astro Goods,79400,Instant,15.0
Tani Organic Pure Lemon Juice Alora,21500,Instant,0.0
Minute Maid Pulpy Orange Pet Dus 300ml,69120,Instant,10.0
Diamond Juice Orange Unsweetened,7000,Instant,0.0
Diamond Juice Blueberry Unsweetened,30800,Instant,0.0
Diamond Juice Cranberry Unsweetened,30800,Instant,0.0
Diamond Juice Blueberry Unsweetened UHT,6400,Instant,0.0
Diamond Jungle Juice Lemon,35200,Instant,0.0
Diamond Jungle Juice Mango,35100,Instant,0.0
Diamond Jungle Juice Grape,35300,Instant,0.0
Diamond Jungle Juice Pineapple,35200,Instant,0.0
Sunfresh Premium Apple Juice,50700,Instant,0.0
Sunfresh Premium Pineapple Juice,56300,Instant,0.0
Sunfresh Premium Orange Juice Unsweetened,57400,Instant,0.0
Buavita Jus Leci,9100,Instant,0.0
Buavita Korean White Peach Juice,11000,Instant,1.0
Diamond Jungle Juice Apple,35200,Instant,0.0
Diamond Jungle Juice Guava,35200,Instant,0.0
Diamond Jungle Juice Orange,35200,Instant,0.0
Buavita Jus Jambu,29500,Instant,14.0
Diamond Juice Cranberry,40800,Instant,0.0
Buavita Jus Mangga,9100,Instant,0.0
Buavita Jus Jambu,9100,Instant,0.0
Ichitan Korean Banana Milk,9500,Instant,0.0
Yeo's Grass Jelly Can,7700,Instant,0.0
Pororo Blueberry Flavored,16300,Instant,0.0
Nescafe Gula Aren Coffee,7500,Instant,0.0
Baked. Coffee Can Oat Mocha Latte,41300,Instant,0.0
Baked. Coffee Oat Latte Can,41300,Instant,0.0
Baked. Coffee Latte Can,36100,Instant,0.0
Baked. Cold Brew Coffee Can,31000,Instant,0.0
Nescafe Ice Black Can,7800,Instant,0.0
Good Day Avocado Delight Coffee/Kopi,7800,Instant,0.0
Good Day Coffee Originale Cappuccino,7800,Instant,0.0
Nescafe Latte Coffee,7200,Instant,0.0
Nescafe Caramel Macchiato Coffee,7200,Instant,0.0
Nescafe Cappuccino Coffee,7200,Instant,0.0
Yakult Minuman Probiotik,10900,Instant,0.0
Yakult Rasa Mangga Minuman Prebiotik,11000,Instant,0.0
Yakult Minuman Probiotik,22500,Instant,0.0
Heavenly Blush Greek Bfast Yogurt Drink,16500,Instant,0.0
Cimory Mixed Fruit Yogurt Drink UHT,5500,Instant,0.0
Cimory Blueberry Yogurt Drink UHT,5500,Instant,0.0
Heavenly Blush Yoguruto Mango Yogurt Drink,12500,Instant,0.0
Heavenly Blush Yoguruto Lemon Yogurt Drink,12500,Instant,0.0
Cimory Yogurt Drink Strawberry Zero Sugar,10000,Instant,0.0
Cimory Yogurt Drink Strawberry & Mango Zero Sugar,10000,Instant,0.0
KIN Bugarian Slimberriies Yogurt Drink,9500,Instant,5.0
Cimory Mixed Fruit Yogurt Drink,8190,Instant,10.0
Cimory Yogurt Drink Mixed Berry,10000,Instant,0.0
Cimory Yogurt Drink Lychee,10000,Instant,0.0
Yakult Light Less Sugar Minuman Probiotik,13300,Instant,0.0
KIN Bulgarian Black Yogurt Drink,9500,Instant,5.0
Greenfields Yogurt Drink Blueberry,8550,Instant,10.0
Greenfields Strawberry Yogurt Drink,9450,Instant,10.0
Heavenly Blush Tummy Blueberry Redbeet Yogurt Drink,17500,Instant,0.0
Heavenly Blush Tummy Mango Carot Yogurt Drink,17500,Instant,0.0
Heavenly Blush Youruto Peach Yogurt Drink,12600,Instant,0.0
Heavenly Blush Youruto Blackcurrant Yogurt Drink,11340,Instant,10.0
Heavenly Blush Yoguruto Strawberry Yogurt Drink,12600,Instant,0.0
Heavenly Blush Yoguruto Original Yogurt Drink,12600,Instant,0.0
KIN Bulgarian Blueberry Yogurt Drink,9500,Instant,5.0
Cimory Yogurt Drink Plain,9100,Instant,0.0
Cimory Blueberry Yogurt Drink,8645,Instant,5.0
Cimory Strawberry Yogurt Drink,9100,Instant,0.0
ChocoDrink Belgian Chocolate Minuman Bubuk 4+2 sachet x 28 gram,7600,Instant,0.0
Red Bull Energy Drink Can Multipack 250ml,98600,Instant,0.0
Redbull Energy Drink,27700,Instant,0.0
Bubuk Tepung Akar Teratai Lotus Root Starch West Lake Brand,45525,Instant,25.0
Milo 3In1 Activ-Go Polybag 340gr,45700,Instant,0.0
One% Nutrition Protein Water Honey Lemon,35000,Instant,0.0
One% Nutrition Protein Water Strawberry,35000,Instant,0.0
Extrajoss Ultimate Can,8500,Instant,0.0
Kratingdaeng Redbull Can,8700,Instant,0.0
Tropicana Slim Almond Drink Chocolicious,10000,Instant,13.0
Tropicana Slim Almond Drink Banana Delight,9600,Instant,14.0
Tropicana Slim Oat Drink,8800,Instant,11.0
Vitmaker Raspberry Lemon Minuman Kolagen,324400,Instant,0.0
Hotto Purto Multigrain Purple Potato Minuman Tinggi Serat,292200,Instant,0.0
SIS Hydro+ Electrolyte Drink Mix Berry,32000,Instant,0.0
NEWLAB Fitlogy Coffee Minuman Diet,209200,Instant,0.0
Enhans Vibe Persik Minuman Tinggi Serat,179000,Instant,0.0
Herbilogy Beetroot Extract Powder Minuman Herbal,104800,Instant,9.0
Vitmaker Raspberry Lemon Minuman Kolagen,139920,Instant,20.0
Herbilogy Empon Mix Extract Powder Minuman Herbal,109500,Instant,0.0
Flimty Raspberry Minuman Tinggi Serat,294600,Instant,0.0
Flimty Blackcurrant Minuman Tinggi Serat,280300,Instant,0.0
Balans Lite Tropical Fruit Fiber & Probiotics Drink,396500,Instant,0.0
Balans Active Powder Mixed Berries Fiber & Probiotics Drink,396500,Instant,0.0
Flimty Raspberry Minuman Tinggi Serat,95800,Instant,1.0
Flimty Mango Minuman Tinggi Serat,95800,Instant,1.0
Iced Choco Black Forest - Regular,22500,Instant,10.0
Iced Choco Black Forest - Large,28800,Instant,10.0
Moontea Peach Oolong Brew Tea - Regular,19800,Instant,10.0
Moontea Roasted Oolong Brew Tea - Large,26100,Instant,10.0
Moontea Peach Oolong Milk Tea - Regular,25200,Instant,10.0
Moontea Roasted Oolong Soy Milk Tea - Regular,29700,Instant,10.0
Moontea Peach Oolong Soy Milk Tea - Regular,29700,Instant,10.0
Moontea Roasted Oolong Soy Milk Tea - Large,36000,Instant,10.0
Moontea Roasted Oolong Milk Tea - Large,31500,Instant,10.0
Moontea Roasted Oolong Milk Tea - Regular,25200,Instant,10.0
Moontea Peach Oolong Brew Tea - Large,26100,Instant,10.0
Moontea Peach Oolong Milk Tea - Large,31500,Instant,10.0
Moontea Peach Oolong Soy Milk Tea - Large,36000,Instant,10.0
Moontea Roasted Oolong Brew Tea - Regular,19800,Instant,10.0
Creamy Sea Salt Matcha Latte - Large,34200,Instant,5.0
Coconut Cloud Matcha Latte - Large,34200,Instant,5.0
Mango Coconut Matcha Latte - Large,34200,Instant,5.0
Creamy Sea Salt Matcha Latte - Regular,27600,Instant,5.0
Coconut Cloud Matcha Latte - Regular,27600,Instant,5.0
Mango Coconut Matcha Latte - Regular,27600,Instant,5.0
Liang Teh & Grass Jelly Large,26600,Instant,5.0
Pink Lemonade - Large,20900,Instant,5.0
Pink Lemonade - Regular,16200,Instant,5.0
Creamy Sea Salt Cold Brew AC x Expat Roasters. - Large,41400,Instant,10.0
Smooth Black Cold Brew AC x Expat Roasters. - Large,38700,Instant,10.0
Peachy Yuzu Cold Brew AC x Expat Roasters. - Large,41400,Instant,10.0
Americano,57000,Instant,5.0
Kopi Susu Gula Aren,80800,Instant,5.0
Kopi Susu Astronauts,85500,Instant,5.0
Signature Chocolate,80800,Instant,5.0
Signature Matcha Latte,90300,Instant,5.0
Smooth Black Cold Brew AC x Expat Roasters. - Regular,34200,Instant,5.0
Peachy Yuzu Cold Brew AC x Expat Roasters. - Regular,36100,Instant,5.0
Creamy Sea Salt Cold Brew AC x Expat Roasters. - Regular,36100,Instant,5.0
Es Markisa Jelly,24000,Instant,0.0
Grass Jelly Milk Tea,24000,Instant,0.0
Liang Teh & Grass Jelly Regular,20000,Instant,0.0
Hibiscus Orange Tea with Boba & Honey Jelly - Regular,20000,Instant,0.0
Butterfly Lemongrass Tea with Boba & Honey Jelly - Regular,20000,Instant,0.0
Lemon Tea with Lychee Jelly - Large,25700,Instant,5.0
Lemon Tea with Lychee Jelly - Regular,19000,Instant,5.0
Mango Tea with Lychee Jelly - Large,25700,Instant,5.0
Mango Tea with Lychee Jelly - Regular,20000,Instant,0.0
Iced Kopi Susu Astronauts - Large,25500,Instant,15.0
Iced Kopi Susu Astronauts - Regular,18300,Instant,15.0
Oat Milk Iced Chocolate Regular,26500,Instant,0.0
Oat Milk Iced Latte Regular,26600,Instant,5.0
Oat Milk Es Kopi Susu Gula Aren Regular,28000,Instant,0.0
Oat Milk Iced Matcha Latte Regular,25100,Instant,15.0
Signature Iced Hazelnut Chocolate - Regular,19400,Instant,23.0
Signature Iced Japanese Milk Tea - Regular,26500,Instant,0.0
Iced Yuzu Lemon Tea - Regular,14700,Instant,6.0
Iced Manuka Honey Black Tea - Regular,21000,Instant,0.0
Signature Iced Matcha Latte - Regular,23500,Instant,8.0
Signature Iced Hazelnut Chocolate - Large,25700,Instant,20.0
Signature Iced Chocolate - Large,23300,Instant,5.0
Signature Iced Chocolate - Regular,17600,Instant,5.0
Signature Iced Black Tea - Regular,11700,Instant,10.0
Iced Manuka Honey Green Tea - Regular,21000,Instant,0.0
Iced Jasmine Green Tea - Regular,13000,Instant,0.0
Signature Iced Japanese Milk Tea - Large,30600,Instant,10.0
Iced Yuzu Lemon Tea - Large,21400,Instant,5.0
Iced Manuka Honey Black Tea - Large,26500,Instant,0.0
Signature Iced Black Tea - Large,16500,Instant,0.0
Iced Manuka Honey Green Tea - Large,26500,Instant,0.0
Signature Iced Matcha Latte - Large,34000,Instant,0.0
Iced Jasmine Green Tea - Large,21600,Instant,8.0
Iced Manuka Honey Latte (Espresso Base) - Large,31000,Instant,0.0
Iced Hazelnut Latte (Espresso Base) - Large,29000,Instant,0.0
Iced Salted Caramel Latte (Espresso Base) - Large,28500,Instant,5.0
Iced Kopi Susu Gula Aren (Espresso Base) - Large,20800,Instant,20.0
Iced Plain Latte (Espresso Base) - Large,25700,Instant,5.0
Iced Americano (Espresso Base) - Large,14400,Instant,20.0
Iced Manuka Honey Latte (Espresso Base) - Regular,24000,Instant,0.0
Iced Hazelnut Latte (Espresso Base) - Regular,22000,Instant,0.0
Iced Salted Caramel Latte (Espresso Base) - Regular,17600,Instant,20.0
Iced Kopi Susu Gula Aren (Espresso Base) - Regular,16200,Instant,15.0
Iced Plain Latte (Espresso Base) - Regular,17100,Instant,5.0
Iced Americano (Espresso Base) - Regular,12800,Instant,15.0
ABC Sirup Squash Delight Jeruk Florida,17600,Instant,0.0
[Bundle] 3 Diamond Full Cream Susu UHT 1000 ml + 1 Matcha Drink Pillow - Astro Kids,155400,Instant,0.0
Herba Original Minuman Madu Enak,19100,Instant,0.0
Matcha Drink Pillow Astro Kids,90000,Instant,0.0
Heavenly Blush Tummy Passionfruit Sugar Free Yogurt Drink 180ml,8500,Instant,50.0
Heavenly Blush Tummy Lemon Sugar Free Yogurt Drink 180ml,8500,Instant,50.0
Heavenly Blush Tummy Guanabana Soursop Sugar Free Yogurt Drink 180ml,8500,Instant,50.0
Kombucha Variant Lavender Mambucha,44300,Instant,0.0
Heavenly Blush Greek Yogurt Plain,45090,Instant,10.0
Biokul Set Yogurt Plain,46100,Instant,0.0
Biokul To Go Bluberry Yogurt,7300,Instant,0.0
Biokul To Go Strawberry Yogurt,7300,Instant,0.0
Biokul Greek Yogurt Honey,14100,Instant,0.0
Biokul To Go Plain Yogurt,7300,Instant,0.0
Biokul Greek Yogurt Mango,72200,Instant,0.0
Biokul Greek Yogurt Topping Strawberry,19400,Instant,0.0
Biokul Greek Yogurt Topping Cookies,19400,Instant,0.0
Biokul To Go Mixberry Yogurt,7300,Instant,0.0
Biokul To Go Lychee Yogurt,7300,Instant,0.0
Biokul To Go Mango Yogurt,7300,Instant,0.0
Heavenly Blush Greek Yogurt Honey,27100,Instant,0.0
Cimory Stick Blueberry Yogurt Box,65300,Instant,16.0
Cimory Stick Strawberry Yogurt Box,65300,Instant,16.0
Cimory Squeeze Mango Sticky Rice Yogurt,10000,Instant,17.0
Biokul Stired Yogurt Plain,9300,Instant,0.0
Cimory Squeeze Strawberry Yogurt,10000,Instant,17.0
Heavenly Blush Greek Yogurt Peach,24390,Instant,10.0
Heavenly Blush Greek Yogurt Granola,24390,Instant,10.0
Jardin Signature Americano Sweet,13500,Instant,0.0
Milo Activ-Go Susu UHT,5800,Instant,0.0
Hilo School Chocolate Susu UHT RTD,7400,Instant,17.0
Milk Life Lactose Free Susu UHT,6400,Instant,0.0
Nutrive Benecol Lychee Multipack 100ml,54100,Instant,5.0
Nutrive Benecol Strawberry Multipack 100ml,54100,Instant,5.0
Meiji Yogurt Plain,22000,Instant,0.0
Meiji Yogurt Mango,22000,Instant,0.0
Meiji Yogurt Mixed Berry,22000,Instant,0.0
Cimory Yogurt Stick Orange 25 pcs x 40 gr,65300,Instant,16.0
Biokul To Go Yuzu Yogurt,7300,Instant,0.0
Biokul To Go Marshmallow Yogurt,6570,Instant,10.0
Biokul To Go Brown Sugar Latte Yogurt,6570,Instant,10.0
Biokul Greek Yogurt Plain,63500,Instant,0.0
Yoseo Creamix Caramel Topping Choco Nut Crunch Yogurt,14900,Instant,0.0
KIN Yogurt Slurp XL Blueberry Yogurt Pouch,8400,Instant,6.0
Cimory Bites Blueberry Yogurt,8700,Instant,0.0
Cimory Bites Strawberry Mango Yogurt,8700,Instant,0.0
Cimory Bites Berry Blend Yogurt,8700,Instant,0.0
Cimory Bites Yuzu Yogurt,8700,Instant,0.0
Cimory Bites Strawberry Lychee Yogurt,8700,Instant,0.0
Heavenly Blush Greek Yogurt Lychee,27100,Instant,0.0
Cimory Greek Yogurt Low Fat,43400,Instant,0.0
Heavenly Blush Greek Yogurt Original,94680,Instant,10.0
Greenfields Strawberry Yogurt Pouch,8300,Instant,21.0
Biokul Stired Yogurt Strawberry,9300,Instant,0.0
Cimory Greek Yogurt Plain,43400,Instant,0.0
Heavenly Blush Greek Yogurt Classic,19500,Instant,0.0
Cimory Squeeze Peach Yogurt,10000,Instant,17.0
Heavenly Blush Greek Yogurt Strawberry,24390,Instant,10.0
Biokul Stired Yogurt Plain,69200,Instant,0.0
Greenfields Blueberry Yogurt,15300,Instant,10.0
Cimory Squeeze Blueberry Yogurt,10000,Instant,17.0
Milk Life Kids Strawberry Milkshake 115ml Susu UHT 1 Dus,125000,Instant,0.0
Milk Life Kids Classic Chocolate 115ml Susu UHT 1 Dus,125000,Instant,0.0
Milk Life Chocolate Susu UHT,20800,Instant,0.0
Milk Life Full Cream Susu UHT,20800,Instant,0.0
Milk Life Teens Full Cream Susu UHT,5500,Instant,0.0
Milk Life Teens Strawberry Susu UHT,5200,Instant,0.0
Cimory Milk Tea Susu UHT,6200,Instant,18.0
Cimory Thai Tea Susu UHT,6200,Instant,18.0
Cimory Strawberry Susu UHT,7500,Instant,0.0
Diamond Milk All Purpose Susu UHT,21900,Instant,0.0
Cimory Strawberry Susu UHT,17500,Instant,23.0
Cimory Chocolate Susu UHT,12500,Instant,29.0
Cimory Marie Regal Susu UHT,17500,Instant,23.0
Morinaga Chil Go Strawberry Milk 130ml,33200,Instant,8.0
