Nama Produk,harga,pengiriman,diskon
Organic Milk by Ultra Milk Susu UHT Organik,30000,Instant,25.0
Milk Life Lactose Free Susu UHT Dus 200ml,133900,Instant,0.0
Frisian Flag ENERGO+ Mixed Berries Susu UHT,7600,Instant,9.0
Milo Cool Sensasi Dingin Susu RTD,10300,Instant,0.0
Greenfields Cafe Latte Susu UHT,7000,Instant,0.0
Ultra Milk Mocca Susu UHT,17900,Instant,0.0
Pediasure Go Chocolate 1-10 Tahun Susu UHT,14700,Instant,0.0
Bear Brand Gold White Tea Susu Sterill,10300,Instant,0.0
Greenfields Chocolate Susu UHT 200 ml,220200,Instant,0.0
Greenfields Strawberry Susu UHT 200 ml,220200,Instant,0.0
Greenfields Full Cream Susu UHT 200 ml,220200,Instant,0.0
Collagena Susu Steril Kolagen,13500,Instant,0.0
Milku Original Susu UHT,3700,Instant,0.0
Frisian Flag Nutribrain Strawberry Susu UHT 110ml,98500,Instant,16.0
Frisian Flag Nutribrain Chocolate Susu UHT 110ml,98500,Instant,16.0
Cimory Matcha Susu UHT,7300,Instant,0.0
Ultra Milk Chocolate Susu UHT,17900,Instant,0.0
Ultra Mimi Kids Vanila Susu UHT 125 ml,138700,Instant,0.0
Cimory Chocolate Mint Susu UHT,6000,Instant,18.0
Greenfields Strawberry Susu UHT 105 ml,153700,Instant,0.0
Greenfields Full Cream Susu UHT Dus 105 ml,153700,Instant,0.0
Greenfields Chocolate Susu UHT Dus 105 ml,153700,Instant,0.0
Greenfields Chocolate Susu UHT,8500,Instant,0.0
Greenfields Chocolate Susu UHT,7000,Instant,0.0
Greenfields Full Cream Susu UHT,8500,Instant,0.0
Frisian Flag Low Fat Belgian Chocolate Susu UHT,6800,Instant,10.0
Ultra Milk Taro Susu UHT,6400,Instant,0.0
Ultra Milk Strawberry Susu UHT,3900,Instant,0.0
Ultra Milk Mocca Susu UHT,7700,Instant,0.0
Ultra Milk Low Fat Susu UHT,8400,Instant,0.0
Ultra Milk Low Fat Chocolate Susu UHT,8400,Instant,0.0
Ultra Milk Karamel Susu UHT,6400,Instant,0.0
Ultra Milk Chocolate Susu UHT,3900,Instant,0.0
Ovaltine Cokelat Malt Susu UHT,27200,Instant,0.0
Tujuh Kurma Susu Steril Kurma,12000,Instant,0.0
Greenfields Strawberry Susu UHT,7000,Instant,0.0
Milo Active-Go Susu UHT Multipack 110ml,13200,Instant,0.0
Diamond Low Fat High Calcium Susu UHT,21800,Instant,0.0
Ultra Mimi Kids Chocolate Susu UHT 125 ml,134000,Instant,0.0
Greenfields Full Cream Susu UHT,7000,Instant,0.0
Milku Chocolate Premium Susu UHT,3700,Instant,0.0
Mujigae Banana Milk Original Susu UHT,10100,Instant,8.0
Cimory Choco Malt Susu UHT,6000,Instant,18.0
Cimory Choco Cashew Susu UHT,6000,Instant,18.0
Cimory Blueberry Susu UHT,6000,Instant,18.0
Milk Life Kids Strawberry Milkshake Susu UHT,3000,Instant,0.0
Milk Life Kids Chocolate Susu UHT,3000,Instant,0.0
Cimory Marie Regal Susu UHT,7300,Instant,0.0
Cimory Choco Hazelnut Susu UHT,6000,Instant,18.0
Cimory Choco Almond Susu UHT,6000,Instant,18.0
Cimory Bebas Laktosa Susu UHT,6000,Instant,18.0
Cimory Chocolate Susu UHT,6000,Instant,18.0
